{
  "$schema": "https://json-schema.org/draft/2020-12/schema",
  "title": "Agent Execution Template Metrics Schema",
  "type": "object",
  "required": [
    "protocol_version",
    "task_id",
    "task_type",
    "model",
    "model_tier",
    "escalated",
    "escalation_reason",
    "model_policy_followed",
    "escalation_trigger_hit",
    "strong_model_role",
    "input_tokens_estimated",
    "output_tokens_estimated",
    "duration_minutes",
    "success",
    "human_fix_required",
    "failure_reason",
    "reuse_potential",
    "notes"
  ],
  "properties": {
    "protocol_version": {
      "const": "0.8"
    },
    "task_id": {
      "type": "string"
    },
    "task_type": {
      "type": "string"
    },
    "model": {
      "type": "string"
    },
    "model_tier": {
      "enum": [
        "cheap",
        "standard",
        "strong"
      ]
    },
    "escalated": {
      "type": "boolean"
    },
    "escalation_reason": {
      "type": "string"
    },
    "model_policy_followed": {
      "type": "boolean"
    },
    "escalation_trigger_hit": {
      "type": "string"
    },
    "strong_model_role": {
      "type": "string"
    },
    "input_tokens_estimated": {
      "type": "integer",
      "minimum": 0
    },
    "output_tokens_estimated": {
      "type": "integer",
      "minimum": 0
    },
    "duration_minutes": {
      "type": "number",
      "minimum": 0
    },
    "success": {
      "type": "boolean"
    },
    "human_fix_required": {
      "type": "boolean"
    },
    "failure_reason": {
      "type": "string"
    },
    "reuse_potential": {
      "enum": [
        "low",
        "medium",
        "high"
      ]
    },
    "notes": {
      "type": "array",
      "items": {
        "type": "string"
      }
    }
  },
  "allOf": [
    {
      "if": {
        "properties": {
          "escalated": {
            "const": true
          }
        }
      },
      "then": {
        "properties": {
          "escalation_reason": {
            "minLength": 1
          },
          "escalation_trigger_hit": {
            "minLength": 1
          },
          "strong_model_role": {
            "minLength": 1
          }
        }
      }
    }
  ]
}
