{
  "protocol_version": "0.8",
  "task_id": "20260516-slash-command-routing",
  "task_type": "feature",
  "model": "GPT-5",
  "model_tier": "cheap",
  "escalated": false,
  "escalation_reason": "",
  "model_policy_followed": true,
  "escalation_trigger_hit": "",
  "strong_model_role": "",
  "input_tokens_estimated": 0,
  "output_tokens_estimated": 0,
  "duration_minutes": 0,
  "success": true,
  "human_fix_required": false,
  "failure_reason": "",
  "reuse_potential": "high",
  "notes": [
    "AI 工作流触发入口已改为 slash command。",
    "普通问答保持只读，不进入执行工作流。"
  ]
}
